{"artifact":"archbird-provider-facts","capabilities":[],"diagnostics":[],"facts":[],"inputs":[{"project":"fuzz","source_manifest_sha256":"1111111111111111111111111111111111111111111111111111111111111111"}],"producer":{"configuration_sha256":"2222222222222222222222222222222222222222222222222222222222222222","implementation_sha256":"3333333333333333333333333333333333333333333333333333333333333333","name":"fuzz-provider","version":"1"},"provenance":"derived","resolutions":[],"schema_version":1,"subject":{"project":"fuzz","scope":"project"}}
